{
  "project_id": "RSKTY-1337",
  "generated_at": "2023-10-15T14:32:00Z",
  "data_version": "1.0",
  "project": {
    "region_number": 1,
    "review_type": "Triennial Review",
    "recipient_name": "Greater New Haven Transit District",
    "recipient_acronym": "GNHTD",
    "recipient_city_state": "Hamden, CT",
    "recipient_id": "1337",
    "recipient_website": "www.gnhtd.org",
    "site_visit_dates": "TBD",
    "site_visit_start_date": null,
    "site_visit_end_date": null,
    "report_date": "2023-11-30",
    "exit_conference_format": "virtual"
  },
  "contractor": {
    "lead_reviewer_name": "Bobby Killebrew",
    "contractor_name": "Qi Tech, LLC",
    "lead_reviewer_phone": "512-350-9912",
    "lead_reviewer_email": "bobby_killebrew@qitechllc.com"
  },
  "fta_program_manager": {
    "fta_program_manager_name": "Syed T. Ahmed",
    "fta_program_manager_title": "General Engineer",
    "fta_program_manager_phone": "617-494-3254",
    "fta_program_manager_email": "syed.ahmed@dot.gov"
  },
  "assessments": [
    {
      "review_area": "Legal",
      "finding": "ND",
      "deficiency_code": null,
      "description": null,
      "corrective_action": null,
      "due_date": null,
      "date_closed": null
    },
    {
      "review_area": "Financial Management and Capacity",
      "finding": "ND",
      "deficiency_code": null,
      "description": null,
      "corrective_action": null,
      "due_date": null,
      "date_closed": null
    },
    {
      "review_area": "Technical Capacity - Award Management",
      "finding": "ND",
      "deficiency_code": null,
      "description": null,
      "corrective_action": null,
      "due_date": null,
      "date_closed": null
    },
    {
      "review_area": "Technical Capacity - Program Management and Subrecipient Oversight",
      "finding": "D",
      "deficiency_code": "D-2023-001",
      "description": "Subrecipient oversight procedures need enhancement",
      "corrective_action": "Develop and implement enhanced subrecipient monitoring plan",
      "due_date": "2024-03-31",
      "date_closed": null
    },
    {
      "review_area": "Technical Capacity - Project Management",
      "finding": "ND",
      "deficiency_code": null,
      "description": null,
      "corrective_action": null,
      "due_date": null,
      "date_closed": null
    },
    {
      "review_area": "Transit Asset Management",
      "finding": "ND",
      "deficiency_code": null,
      "description": null,
      "corrective_action": null,
      "due_date": null,
      "date_closed": null
    },
    {
      "review_area": "Satisfactory Continuing Control",
      "finding": "ND",
      "deficiency_code": null,
      "description": null,
      "corrective_action": null,
      "due_date": null,
      "date_closed": null
    },
    {
      "review_area": "Maintenance",
      "finding": "ND",
      "deficiency_code": null,
      "description": null,
      "corrective_action": null,
      "due_date": null,
      "date_closed": null
    },
    {
      "review_area": "Procurement",
      "finding": "ND",
      "deficiency_code": null,
      "description": null,
      "corrective_action": null,
      "due_date": null,
      "date_closed": null
    },
    {
      "review_area": "Disadvantaged Business Enterprise",
      "finding": "ND",
      "deficiency_code": null,
      "description": null,
      "corrective_action": null,
      "due_date": null,
      "date_closed": null
    },
    {
      "review_area": "Title VI",
      "finding": "ND",
      "deficiency_code": null,
      "description": null,
      "corrective_action": null,
      "due_date": null,
      "date_closed": null
    },
    {
      "review_area": "Americans with Disabilities Act (ADA) - General",
      "finding": "ND",
      "deficiency_code": null,
      "description": null,
      "corrective_action": null,
      "due_date": null,
      "date_closed": null
    },
    {
      "review_area": "Americans with Disabilities Act (ADA) - Complementary Paratransit",
      "finding": "ND",
      "deficiency_code": null,
      "description": null,
      "corrective_action": null,
      "due_date": null,
      "date_closed": null
    },
    {
      "review_area": "Equal Employment Opportunity",
      "finding": "ND",
      "deficiency_code": null,
      "description": null,
      "corrective_action": null,
      "due_date": null,
      "date_closed": null
    },
    {
      "review_area": "School Bus",
      "finding": "NA",
      "deficiency_code": null,
      "description": null,
      "corrective_action": null,
      "due_date": null,
      "date_closed": null
    },
    {
      "review_area": "Charter Bus",
      "finding": "ND",
      "deficiency_code": null,
      "description": null,
      "corrective_action": null,
      "due_date": null,
      "date_closed": null
    },
    {
      "review_area": "Drug-Free Workplace Act",
      "finding": "ND",
      "deficiency_code": null,
      "description": null,
      "corrective_action": null,
      "due_date": null,
      "date_closed": null
    },
    {
      "review_area": "Drug and Alcohol Program",
      "finding": "ND",
      "deficiency_code": null,
      "description": null,
      "corrective_action": null,
      "due_date": null,
      "date_closed": null
    },
    {
      "review_area": "Section 5307 Program Requirements",
      "finding": "ND",
      "deficiency_code": null,
      "description": null,
      "corrective_action": null,
      "due_date": null,
      "date_closed": null
    },
    {
      "review_area": "Section 5310 Program Requirements",
      "finding": "NA",
      "deficiency_code": null,
      "description": null,
      "corrective_action": null,
      "due_date": null,
      "date_closed": null
    },
    {
      "review_area": "Section 5311 Program Requirements",
      "finding": "NA",
      "deficiency_code": null,
      "description": null,
      "corrective_action": null,
      "due_date": null,
      "date_closed": null
    },
    {
      "review_area": "Public Transportation Agency Safety Plan (PTASP)",
      "finding": "ND",
      "deficiency_code": null,
      "description": null,
      "corrective_action": null,
      "due_date": null,
      "date_closed": null
    },
    {
      "review_area": "Cybersecurity",
      "finding": "ND",
      "deficiency_code": null,
      "description": null,
      "corrective_action": null,
      "due_date": null,
      "date_closed": null
    }
  ],
  "erf_items": [],
  "metadata": {
    "has_deficiencies": true,
    "deficiency_count": 1,
    "deficiency_areas": ["Technical Capacity - Program Management and Subrecipient Oversight"],
    "erf_count": 0,
    "reviewed_subrecipients": false,
    "subrecipient_name": null,
    "fiscal_year": "FY2023",
    "review_status": "Completed"
  }
}
