{
  "project_id": "RSKTY-1456",
  "generated_at": "2023-11-18T09:45:00Z",
  "data_version": "1.0",
  "project": {
    "region_number": 3,
    "review_type": "Triennial Review",
    "recipient_name": "Transportation District Commission of Hampton Roads",
    "recipient_acronym": "HRT",
    "recipient_city_state": "Hampton, VA",
    "recipient_id": "1456",
    "recipient_website": "https://gohrt.com/",
    "site_visit_dates": "TBD",
    "site_visit_start_date": null,
    "site_visit_end_date": null,
    "report_date": "2024-01-31",
    "exit_conference_format": "virtual"
  },
  "contractor": {
    "lead_reviewer_name": "Ellen Harvey",
    "contractor_name": "Calyptus Consulting Group, Inc.",
    "lead_reviewer_phone": "617-577-0042",
    "lead_reviewer_email": "eharvey@calyptusgroup.com"
  },
  "fta_program_manager": {
    "fta_program_manager_name": "Jason Yucis",
    "fta_program_manager_title": "Financial Analyst",
    "fta_program_manager_phone": "202-366-XXXX",
    "fta_program_manager_email": "jason.yucis@dot.gov"
  },
  "assessments": [
    {
      "review_area": "Legal",
      "finding": "ND",
      "deficiency_code": null,
      "description": null,
      "corrective_action": null,
      "due_date": null,
      "date_closed": null
    },
    {
      "review_area": "Financial Management and Capacity",
      "finding": "D",
      "deficiency_code": "D-2023-002",
      "description": "Financial reporting procedures require documentation updates",
      "corrective_action": "Update and document financial reporting procedures manual",
      "due_date": "2024-04-30",
      "date_closed": null
    },
    {
      "review_area": "Technical Capacity - Award Management",
      "finding": "ND",
      "deficiency_code": null,
      "description": null,
      "corrective_action": null,
      "due_date": null,
      "date_closed": null
    },
    {
      "review_area": "Technical Capacity - Program Management and Subrecipient Oversight",
      "finding": "ND",
      "deficiency_code": null,
      "description": null,
      "corrective_action": null,
      "due_date": null,
      "date_closed": null
    },
    {
      "review_area": "Technical Capacity - Project Management",
      "finding": "ND",
      "deficiency_code": null,
      "description": null,
      "corrective_action": null,
      "due_date": null,
      "date_closed": null
    },
    {
      "review_area": "Transit Asset Management",
      "finding": "D",
      "deficiency_code": "D-2023-003",
      "description": "TAM plan needs update to reflect current inventory",
      "corrective_action": "Update Transit Asset Management plan with complete asset inventory",
      "due_date": "2024-03-15",
      "date_closed": null
    },
    {
      "review_area": "Satisfactory Continuing Control",
      "finding": "ND",
      "deficiency_code": null,
      "description": null,
      "corrective_action": null,
      "due_date": null,
      "date_closed": null
    },
    {
      "review_area": "Maintenance",
      "finding": "ND",
      "deficiency_code": null,
      "description": null,
      "corrective_action": null,
      "due_date": null,
      "date_closed": null
    },
    {
      "review_area": "Procurement",
      "finding": "ND",
      "deficiency_code": null,
      "description": null,
      "corrective_action": null,
      "due_date": null,
      "date_closed": null
    },
    {
      "review_area": "Disadvantaged Business Enterprise",
      "finding": "ND",
      "deficiency_code": null,
      "description": null,
      "corrective_action": null,
      "due_date": null,
      "date_closed": null
    },
    {
      "review_area": "Title VI",
      "finding": "ND",
      "deficiency_code": null,
      "description": null,
      "corrective_action": null,
      "due_date": null,
      "date_closed": null
    },
    {
      "review_area": "Americans with Disabilities Act (ADA) - General",
      "finding": "ND",
      "deficiency_code": null,
      "description": null,
      "corrective_action": null,
      "due_date": null,
      "date_closed": null
    },
    {
      "review_area": "Americans with Disabilities Act (ADA) - Complementary Paratransit",
      "finding": "ND",
      "deficiency_code": null,
      "description": null,
      "corrective_action": null,
      "due_date": null,
      "date_closed": null
    },
    {
      "review_area": "Equal Employment Opportunity",
      "finding": "ND",
      "deficiency_code": null,
      "description": null,
      "corrective_action": null,
      "due_date": null,
      "date_closed": null
    },
    {
      "review_area": "School Bus",
      "finding": "NA",
      "deficiency_code": null,
      "description": null,
      "corrective_action": null,
      "due_date": null,
      "date_closed": null
    },
    {
      "review_area": "Charter Bus",
      "finding": "ND",
      "deficiency_code": null,
      "description": null,
      "corrective_action": null,
      "due_date": null,
      "date_closed": null
    },
    {
      "review_area": "Drug-Free Workplace Act",
      "finding": "ND",
      "deficiency_code": null,
      "description": null,
      "corrective_action": null,
      "due_date": null,
      "date_closed": null
    },
    {
      "review_area": "Drug and Alcohol Program",
      "finding": "ND",
      "deficiency_code": null,
      "description": null,
      "corrective_action": null,
      "due_date": null,
      "date_closed": null
    },
    {
      "review_area": "Section 5307 Program Requirements",
      "finding": "ND",
      "deficiency_code": null,
      "description": null,
      "corrective_action": null,
      "due_date": null,
      "date_closed": null
    },
    {
      "review_area": "Section 5310 Program Requirements",
      "finding": "NA",
      "deficiency_code": null,
      "description": null,
      "corrective_action": null,
      "due_date": null,
      "date_closed": null
    },
    {
      "review_area": "Section 5311 Program Requirements",
      "finding": "NA",
      "deficiency_code": null,
      "description": null,
      "corrective_action": null,
      "due_date": null,
      "date_closed": null
    },
    {
      "review_area": "Public Transportation Agency Safety Plan (PTASP)",
      "finding": "ND",
      "deficiency_code": null,
      "description": null,
      "corrective_action": null,
      "due_date": null,
      "date_closed": null
    },
    {
      "review_area": "Cybersecurity",
      "finding": "ND",
      "deficiency_code": null,
      "description": null,
      "corrective_action": null,
      "due_date": null,
      "date_closed": null
    }
  ],
  "erf_items": [
    {
      "erf_area": "Financial Oversight",
      "focus_description": "Enhanced review of grant financial reporting",
      "completion_status": "In Progress"
    }
  ],
  "metadata": {
    "has_deficiencies": true,
    "deficiency_count": 2,
    "deficiency_areas": [
      "Financial Management and Capacity",
      "Transit Asset Management"
    ],
    "erf_count": 1,
    "reviewed_subrecipients": false,
    "subrecipient_name": null,
    "fiscal_year": "FY2023",
    "review_status": "In Progress"
  }
}
